{
  "schema_version": "1.0.0",
  "document_path": "./examples/q2-risk-review.pptx",
  "document_type": "pptx",
  "pipeline_stage": "stage4-residual",
  "generated_at": "2026-05-01T14:15:00Z",
  "upstream_cli_version": "office-a11y-pipeline 0.9.0",
  "findings": [
    {
      "id": "P-001",
      "rule_id": "PPT_READING_ORDER",
      "issue_type": "reading_order",
      "severity": "error",
      "location": "/slide[3]",
      "current_value": {"object_order": ["Title 1", "CTA button", "Chart 4", "Source note"], "visual_order": ["Title 1", "Chart 4", "Source note", "CTA button"]},
      "suggested_value": {"order": ["/slide[3]/shape[name=Title 1]", "/slide[3]/chart[1]", "/slide[3]/shape[5]", "/slide[3]/shape[2]"]},
      "confidence": 0.62,
      "why_human_needed": "The visual order is clear, but moving the CTA may change presenter emphasis.",
      "related_findings_ids": ["P-002"],
      "wcag_sc": ["1.3.2"]
    },
    {
      "id": "P-002",
      "rule_id": "CONTRAST_LOW_CONFIDENCE",
      "issue_type": "color_contrast",
      "severity": "error",
      "location": "/slide[3]/shape[5]/run[1]",
      "current_value": {"text": "Source: Finance Ops", "fg": "#9AA0A6", "bg_theme": "lt1", "font_size_pt": 8},
      "suggested_value": {"fg_theme": "dk1"},
      "confidence": 0.58,
      "why_human_needed": "The background is theme-resolved and the source note is intentionally low-emphasis.",
      "related_findings_ids": ["P-001"],
      "wcag_sc": ["1.4.3"]
    },
    {
      "id": "P-003",
      "rule_id": "IMAGE_DECORATIVE_UNCERTAIN",
      "issue_type": "decorative_or_informative_image",
      "severity": "warning",
      "location": "/slide[4]/picture[2]",
      "current_value": {"alt": "blue line", "nearby_text": "Process timeline", "image_role_guess": "decorative divider"},
      "confidence": 0.51,
      "why_human_needed": "The image may be a decorative divider or may indicate timeline progression.",
      "related_findings_ids": [],
      "wcag_sc": ["1.1.1"]
    },
    {
      "id": "P-004",
      "rule_id": "AI_SLIDE_TITLE_LOW_CONFIDENCE",
      "issue_type": "slide_title",
      "severity": "warning",
      "location": "/slide[5]/shape[name=Title 1]",
      "current_value": {"title": "Overview", "slide_topic": "Top operational risks by region"},
      "suggested_value": {"text": "Operational risks by region"},
      "confidence": 0.64,
      "why_human_needed": "Changing the title may affect presenter intent and agenda wording.",
      "related_findings_ids": [],
      "wcag_sc": ["2.4.6", "2.4.10"]
    },
    {
      "id": "P-005",
      "rule_id": "MERGED_CELLS_REVIEW",
      "issue_type": "merged_cells",
      "severity": "warning",
      "location": "/slide[6]/table[1]/tr[1]/tc[1]",
      "current_value": {"gridSpan": 3, "text": "Q2 risk indicators", "header_like": true},
      "confidence": 0.45,
      "why_human_needed": "The merged cell may be a group title that should remain merged, or it may break table headers.",
      "related_findings_ids": [],
      "wcag_sc": ["1.3.1"]
    }
  ]
}
