{
  "schema_version": "1.0.0",
  "document_path": "./examples/benefits-guide.docx",
  "document_type": "docx",
  "pipeline_stage": "stage4-residual",
  "generated_at": "2026-05-01T14:00:00Z",
  "upstream_cli_version": "office-a11y-pipeline 0.9.0",
  "findings": [
    {
      "id": "D-001",
      "rule_id": "WORD_HEADING_SKIPPED",
      "issue_type": "heading_structure",
      "severity": "warning",
      "location": "/body/p[8]",
      "current_value": {"text": "Eligibility", "style": "Subtitle", "previous_heading": "Heading1", "next_heading": "Heading3"},
      "suggested_value": {"style": "Heading2"},
      "confidence": 0.82,
      "why_human_needed": "The paragraph is visually styled as a section heading but upstream could not prove whether it is semantic or decorative.",
      "related_findings_ids": ["D-002"],
      "wcag_sc": ["1.3.1", "2.4.10"]
    },
    {
      "id": "D-002",
      "rule_id": "WORD_HEADING_SKIPPED",
      "issue_type": "heading_structure",
      "severity": "warning",
      "location": "/body/p[12]",
      "current_value": {"text": "Dependent coverage", "style": "Heading3", "previous_heading": "Heading1"},
      "suggested_value": {"expected_parent": "/body/p[8]"},
      "confidence": 0.76,
      "why_human_needed": "Depends on whether /body/p[8] should become a Heading2.",
      "related_findings_ids": ["D-001"],
      "wcag_sc": ["1.3.1"]
    },
    {
      "id": "D-003",
      "rule_id": "LAYOUT_TABLE_REVIEW",
      "issue_type": "complex_table",
      "severity": "warning",
      "location": "/body/tbl[2]",
      "current_value": {"rows": 3, "columns": 2, "borders": "none", "contains": "prose plus icons", "header_row": false},
      "confidence": 0.42,
      "why_human_needed": "The table may be a visual two-column layout rather than a data table; flattening would change document structure.",
      "related_findings_ids": [],
      "wcag_sc": ["1.3.1", "1.3.2"]
    },
    {
      "id": "D-004",
      "rule_id": "AI_ALT_LOW_CONFIDENCE",
      "issue_type": "decorative_or_informative_image",
      "severity": "warning",
      "location": "/body/p[16]/picture[1]",
      "current_value": {"alt": "people", "nearby_text": "Employees enrolling online", "image_role_guess": "stock photo"},
      "suggested_value": {"alt": "Employee using a laptop to enroll in benefits"},
      "confidence": 0.48,
      "why_human_needed": "The image could be decorative stock photography or could reinforce the enrollment action.",
      "related_findings_ids": [],
      "wcag_sc": ["1.1.1"]
    },
    {
      "id": "D-005",
      "rule_id": "LINK_TEXT_LOW_CONFIDENCE",
      "issue_type": "link_text",
      "severity": "warning",
      "location": "/body/p[21]/hyperlink[1]",
      "current_value": {"text": "Click here", "url": "https://benefits.example.com/enrollment-rules", "sentence": "For enrollment rules, click here."},
      "suggested_value": {"text": "Read enrollment rules"},
      "confidence": 0.9,
      "why_human_needed": "Upstream AI generated link text but did not have enough surrounding section context to commit automatically.",
      "related_findings_ids": [],
      "wcag_sc": ["2.4.6"]
    }
  ]
}
